{
  "$schema": "./crud-schema.json",
  "solutionRoot": ".",
  "apiProject": "src/RhSensoERP.API",
  "webProject": "src/Web",
  "entities": [
    {
      "name": "Sistema",
      "displayName": "Sistema",
      "pluralName": "Sistemas",
      "module": "Identity",
      "tableName": "tsistema",
      "cdSistema": "SEG",
      "cdFuncao": "SEG_FM_TSISTEMA",
      "primaryKey": {
        "property": "CdSistema",
        "type": "string",
        "column": "cdsistema"
      },
      "properties": [
        {
          "name": "CdSistema",
          "type": "string",
          "column": "cdsistema",
          "displayName": "Código",
          "maxLength": 10,
          "required": true,
          "isPrimaryKey": true
        },
        {
          "name": "DcSistema",
          "type": "string",
          "column": "dcsistema",
          "displayName": "Descrição",
          "maxLength": 100,
          "required": true
        },
        {
          "name": "Ativo",
          "type": "string",
          "column": "ativo",
          "displayName": "Ativo",
          "maxLength": 1,
          "defaultValue": "S"
        }
      ],
      "generate": {
        "apiController": true,
        "webController": true,
        "webModels": true,
        "webServices": true,
        "view": false,
        "javascript": false
      }
    },
    {
      "name": "Usuario",
      "displayName": "Usuário",
      "pluralName": "Usuarios",
      "module": "Identity",
      "tableName": "tuse1",
      "cdSistema": "SEG",
      "cdFuncao": "SEG_FM_USUARIO",
      "primaryKey": {
        "property": "IdUsuario",
        "type": "int",
        "column": "idusuario"
      },
      "properties": [
        {
          "name": "IdUsuario",
          "type": "int",
          "column": "idusuario",
          "displayName": "ID",
          "required": true,
          "isPrimaryKey": true,
          "isReadOnly": true
        },
        {
          "name": "CdUsuario",
          "type": "string",
          "column": "cdusuario",
          "displayName": "Código do Usuário",
          "maxLength": 20,
          "required": true
        },
        {
          "name": "NmUsuario",
          "type": "string",
          "column": "nmusuario",
          "displayName": "Nome",
          "maxLength": 100,
          "required": true
        },
        {
          "name": "Email",
          "type": "string",
          "column": "email",
          "displayName": "E-mail",
          "maxLength": 150
        },
        {
          "name": "Ativo",
          "type": "string",
          "column": "ativo",
          "displayName": "Ativo",
          "maxLength": 1,
          "defaultValue": "S"
        }
      ],
      "generate": {
        "apiController": true,
        "webController": true,
        "webModels": true,
        "webServices": true
      }
    }
  ]
}
